{
  "$schema": "https://json-schema.org/draft/2020-12/schema",
  "$id": "urn:sylvia:schema:pair-request:v1",
  "title": "Pair request",
  "description": "Body of POST /v1/pair (plan 15.2, ADR-0008). Sent only over a TLS connection whose certificate matched the pairing payload's spki_sha256. invitation_secret is a credential and is never logged or persisted by either side; the Mac compares its SHA-256 in constant time.",
  "type": "object",
  "required": ["schema_version", "invitation_id", "invitation_secret", "source_id", "device_id", "device_name"],
  "properties": {
    "schema_version": { "const": 1 },
    "invitation_id": { "$ref": "#/$defs/uuid" },
    "invitation_secret": {
      "type": "string",
      "minLength": 22,
      "maxLength": 86,
      "pattern": "^[A-Za-z0-9_-]+$"
    },
    "source_id": {
      "description": "The source the phone expects, from the pairing payload. A mismatch is refused (source binding).",
      "$ref": "#/$defs/uuid"
    },
    "device_id": { "$ref": "#/$defs/uuid", "description": "Generated on the phone; one per installation and source." },
    "device_name": {
      "description": "Shown to the Mac user for approval.",
      "type": "string",
      "minLength": 1,
      "maxLength": 64,
      "not": { "pattern": "[\\u0000-\\u001f\\u007f-\\u009f]" }
    }
  },
  "$defs": {
    "uuid": {
      "type": "string",
      "minLength": 36,
      "maxLength": 36,
      "pattern": "^[0-9a-f]{8}-[0-9a-f]{4}-[0-9a-f]{4}-[0-9a-f]{4}-[0-9a-f]{12}$"
    }
  }
}
