{
  "schema_version": 1,
  "invitation_id": "00000000-0000-4000-8000-000000000900",
  "invitation_secret": "q7Hc0bJx2mVt9Wd4LkPz8Rn1Ys6Ea3Gu5Fi0Oh2Tj4M",
  "source_id": "5a1e0c3e-7d2b-4c1a-9f00-000000000001",
  "device_id": "00000000-0000-4000-8000-000000000d01",
  "device_name": "Justin's iPhone"
}
